Provider State,Provider Name,Provider Address,Provider City,Provider Zip Code,Survey Date,Deficiency Tag Number,Scope Severity Code
NY,WHITE OAKS REHABILITATION AND NURSING CENTER,8565 JERICHO TURNPIKE,WOODBURY,11797,2/1/2017 0:00,441,D
NY,"WHITE PLAINS CENTER FOR NURSING CARE, L L C",220 WEST POST ROAD,WHITE PLAINS,10606,3/8/2019 0:00,880,D
NY,"WHITE PLAINS CENTER FOR NURSING CARE, L L C",220 WEST POST ROAD,WHITE PLAINS,10606,7/24/2017 0:00,441,D
NY,WHITTIER REHAB & SKILLED NURSING CENTER,1 WHITTIER WAY,GHENT,12075,11/6/2017 0:00,441,D
NY,"WILLIAMSVILLE SUBURBAN, L L C",163 SOUTH UNION ROAD,WILLIAMSVILLE,14221,4/19/2019 0:00,880,E
NY,"WILLIAMSVILLE SUBURBAN, L L C",163 SOUTH UNION ROAD,WILLIAMSVILLE,14221,3/30/2018 0:00,880,E
NY,WILLOW POINT REHABILITATION AND NURSING CENTER,3700 OLD VESTAL ROAD,VESTAL,13850,4/5/2019 0:00,880,D
NY,WINDSOR PARK NURSING HOME,212 40 HILLSIDE AVENUE,QUEENS VILLAGE,11427,3/27/2018 0:00,880,E
NY,WINGATE OF ULSTER,ONE WINGATE WAY,HIGHLAND,12528,1/25/2019 0:00,880,D
NY,WOODHAVEN NURSING HOME,1360 ROUTE 112,PORT JEFFERSON STATI,11776,11/6/2019 0:00,880,D
NY,WOODHAVEN NURSING HOME,1360 ROUTE 112,PORT JEFFERSON STATI,11776,7/17/2018 0:00,880,D
NY,WOODLAND POND AT NEW PALTZ,100 WOODLAND POND CIRCLE,NEW PALTZ,12561,4/25/2018 0:00,880,F
NY,WYOMING COUNTY COMMUNITY HOSPITAL S N F,400 NORTH MAIN STREET,WARSAW,14569,2/12/2019 0:00,880,D
NY,WYOMING COUNTY COMMUNITY HOSPITAL S N F,400 NORTH MAIN STREET,WARSAW,14569,9/29/2017 0:00,441,D
NY,WYOMING COUNTY COMMUNITY HOSPITAL S N F,400 NORTH MAIN STREET,WARSAW,14569,7/12/2016 0:00,441,D
